{
  "schema_version": "ctoa.equipment-shadow-snapshot.v1",
  "observed_at_unix_ms": 1783799999000,
  "observation_id": "fixture-positive-ring",
  "producer_source": "fixture",
  "source_report_sha256": "1111111111111111111111111111111111111111111111111111111111111111",
  "online": true,
  "alive": true,
  "protection_zone": "outside",
  "protection_zone_source": "player_method",
  "inventory_revision": "2222222222222222222222222222222222222222222222222222222222222222",
  "inventory_unambiguous": true,
  "slot_name": "ring",
  "rollback_slot_name": "ring",
  "equipped_item_id": 3051,
  "candidate_item_id": 3048,
  "rollback_item_id": 3051,
  "rollback_inventory_revision": "2222222222222222222222222222222222222222222222222222222222222222",
  "candidate_source_container_id": 2,
  "candidate_source_slot_index": 1,
  "rollback_destination_container_id": 2,
  "rollback_destination_slot_index": 1,
  "cooldown": "ready",
  "cooldown_source": "game_cooldown_group",
  "dispatch_allowed": false,
  "runtime_actions": false,
  "executes_plan": false,
  "execute_once_allowed": false,
  "promotion_allowed": false,
  "intrusive_actions_performed": []
}
